Station Code,Location,State,Temp Min,Temp Max,Dissoved Oxygen Min,Dissoved Oxygen Max,pH Min,pH Max,Conductivity Min,Conductivity Max,BOD Min,BOD Max,Nitrate Min,Nitrate Max,Fecal Coliform Min,Fecal Coliform Max,Total Coliform Min,Total Coliform Max
1088,"RAVI AT U/S MADHOPUR, H.P.",HIMACHAL PRADESH,11.5,20.0,7.8,9.2,6.3,8.3,149.0,413.0,0.2,4.0,0.1,0.9,,,,
1089,"RAVI AT U/S CHAMBA, H.P.",HIMACHAL PRADESH,7.9,14.8,8.6,8.8,6.8,8.4,92.0,244.0,0.2,0.7,0.1,0.9,8.0,8.0,9.0,60.0
2614,RAVI AT CHAMERA RESERVOIR,HIMACHAL PRADESH,9.5,21.0,8.4,8.9,7.1,8.4,113.0,222.0,0.2,0.8,0.1,3.1,11.0,11.0,17.0,110.0
2615,RAVI AT D/S CHAMERA III HEP,HIMACHAL PRADESH,7.8,15.0,8.5,8.9,6.4,8.9,119.0,399.0,0.2,0.8,0.1,1.1,9.0,9.0,11.0,110.0
2613,RAVI AT D/S OF CHAMBA TOWN,HIMACHAL PRADESH,7.8,15.0,8.5,8.8,6.8,8.5,96.0,237.0,0.2,1.6,0.0,1.1,11.0,11.0,11.0,80.0
1097,"RAVI AT U/S OF MADHOPUR HEADWORKS, GURDASPUR, PUNJAB",PUNJAB,13.0,20.0,8.1,8.3,7.5,7.8,154.0,202.0,0.4,0.4,0.4,0.7,31.0,90.0,70.0,130.0
1290,"PARVATI BEFORE CONF. TO RIVER BEAS, H.P.",HIMACHAL PRADESH,7.0,12.0,8.3,11.1,7.1,8.2,52.0,137.0,0.1,0.2,0.0,0.2,11.0,63.0,130.0,430.0
2605,PARVATI AT U/S MANIKARAN,HIMACHAL PRADESH,2.0,13.0,9.3,11.5,6.7,8.3,43.0,168.0,0.1,0.1,0.0,0.5,4.0,33.0,21.0,110.0
2606,PARVATI AT D/S MANIKARAN,HIMACHAL PRADESH,2.0,13.5,9.2,11.4,6.9,8.1,45.0,158.0,0.1,0.1,0.0,0.1,6.0,49.0,58.0,140.0
1090,"LARGI AT D/S, H.P.",HIMACHAL PRADESH,5.0,17.0,8.7,11.0,7.0,8.2,54.0,161.0,0.1,0.2,0.0,0.2,21.0,94.0,130.0,280.0
1551,"RIVER  SIRSA , U/S SITOMAJRI NALLAHGARH, H.P",HIMACHAL PRADESH,17.0,21.0,5.0,8.1,6.8,8.8,360.0,1261.0,0.8,18.0,0.0,0.3,4.0,12.0,17.0,170.0
1552,"RIVER SIRSA , D/S NALAGARH BRIDGE, H.P",HIMACHAL PRADESH,18.5,23.0,4.5,8.2,7.1,8.0,380.0,1766.0,1.2,10.0,0.0,0.4,4.0,32.0,14.0,220.0
1868,"RIVER SIRSA AT D/S NALAGARH DISTT. SOLAN, H.P.",HIMACHAL PRADESH,18.0,21.0,5.1,8.8,6.9,8.6,418.0,1571.0,1.0,12.0,0.0,0.5,6.0,24.0,24.0,350.0
1869,"RIVER SWAN AT D/S NANGAL DISTT. UNA, H.P.",HIMACHAL PRADESH,10.0,29.0,5.2,7.8,6.8,8.8,395.0,691.0,0.4,6.0,0.2,1.2,21.0,26.0,26.0,170.0
2616,SIUEL AT D/S SURGANI,HIMACHAL PRADESH,7.7,13.8,8.5,10.0,7.0,8.6,149.0,268.0,0.2,1.6,0.0,1.3,9.0,9.0,17.0,80.0
2607,SUKETI KHAD AT D/S MAI,HIMACHAL PRADESH,10.4,29.0,6.2,11.3,7.5,8.6,184.0,437.0,0.1,0.3,0.0,0.4,49.0,540.0,240.0,2400.0
2608,BINWA AT D/S PAPROLA/BAIJNATH,HIMACHAL PRADESH,11.0,21.0,7.2,9.1,7.1,8.6,66.0,430.0,0.2,0.8,0.1,2.2,,,,
2609,NEUGAL AT D/S THURAL,HIMACHAL PRADESH,10.0,24.0,7.3,9.1,7.0,8.4,79.0,173.0,0.2,1.8,0.1,1.2,,,,
2610,SPITI AT KHAB,HIMACHAL PRADESH,9.0,13.0,9.6,10.0,6.6,8.3,66.0,586.0,0.1,0.2,0.0,0.2,,,,
2612,BASPA AT U/S RESERVOIR BASPA PROJECT,HIMACHAL PRADESH,7.0,13.0,9.3,9.8,7.3,8.4,72.0,600.0,0.1,0.2,0.0,0.1,,,,
1867,"RIVER SATLUJ B/C WITH RIVER SPITI AT KHAB, DISTT.KINNAUR, H.P.",HIMACHAL PRADESH,9.0,13.0,9.7,10.0,7.3,8.2,116.0,601.0,0.1,0.2,0.0,0.1,,,,
2611,SATLUJ AT KHAB,HIMACHAL PRADESH,9.0,13.0,9.6,10.1,7.3,8.3,118.0,592.0,0.1,0.2,0.0,0.1,,,,
1389,"SATLUJ AT NEPTHA ZAKHAI, H.P",HIMACHAL PRADESH,10.0,15.0,9.4,9.7,7.3,8.2,67.0,595.0,0.1,0.2,0.0,0.2,,,,
1086,"SATLUJ AT U/S RAMPUR, H.P.",HIMACHAL PRADESH,11.0,17.0,9.2,9.6,7.2,8.6,117.0,603.0,0.1,0.2,0.0,0.1,,,,
1087,"SATLUJ AT D/S RAMPUR, H.P.",HIMACHAL PRADESH,10.0,17.0,9.1,9.6,7.4,8.5,116.0,598.0,0.1,0.2,0.0,0.1,,,,
1013,"SATLUJ AT U/S TATAPANI, H.P.",HIMACHAL PRADESH,11.0,18.0,9.0,9.8,7.1,8.6,86.0,604.0,0.1,0.2,0.0,0.2,,,,
1014,"SATLUJ AT U/S SLAPPER, H.P.",HIMACHAL PRADESH,6.0,18.0,6.0,9.7,7.5,8.4,90.0,303.0,0.1,0.1,0.0,0.4,23.0,79.0,130.0,280.0
1015,"SATLUJ AT D/S SLAPPER, H.P.",HIMACHAL PRADESH,5.0,17.0,8.0,9.8,7.5,8.6,78.0,299.0,0.1,0.1,0.0,0.3,31.0,94.0,170.0,430.0
1016,"SATLUJ AT D/S BHAKHRA, H.P.",HIMACHAL PRADESH,9.0,27.0,5.0,8.0,7.0,8.7,206.0,300.0,0.2,0.7,0.0,0.9,12.0,17.0,33.0,130.0
1017,"SATLUJ AT 100M U/S OF HEADWORKS, NANGAL, PUNJAB",PUNJAB,16.0,20.0,7.8,9.0,7.4,8.0,208.0,260.0,,,0.2,1.0,17.0,35.0,40.0,100.0
1018,"SATLUJ AT 100M D/S , NANGAL, PUNJAB",PUNJAB,17.2,18.0,7.5,8.6,7.5,8.5,230.0,272.0,0.6,0.6,0.7,1.2,230.0,300.0,400.0,430.0
1293,"SATLUJ AT 1 KM. D/S OF ZENITH, PUNJAB",PUNJAB,17.4,25.0,6.4,7.8,7.3,8.0,275.0,495.0,1.6,2.5,1.0,2.0,140.0,930.0,430.0,1400.0
1814,"SATLUJ AT D/S KIRATPUR SAHIB, PUNJAB",PUNJAB,16.0,20.0,7.8,8.2,7.5,7.9,252.0,267.0,0.4,1.2,0.4,1.2,170.0,230.0,400.0,460.0
1019,"SATLUJ AT U/S HEAD WORKS ROPAR, PUNJAB",PUNJAB,17.2,26.0,7.6,8.1,7.3,7.8,205.0,992.0,1.2,2.6,0.4,2.0,110.0,390.0,400.0,640.0
1380,"SATLUJ AT D/S NFL, PUNJAB",PUNJAB,17.0,22.0,7.6,8.9,7.5,8.5,238.0,372.0,0.8,2.5,1.2,1.4,90.0,150.0,140.0,390.0
1690,"U/S BUDHA NALLAH (UPPER), PUNJAB",PUNJAB,12.0,24.0,6.0,6.7,7.2,7.7,388.0,432.0,1.2,2.6,1.0,1.6,140.0,280.0,300.0,640.0
1020,"SATLUJ AT 100M D/S BUDHA NALA CONFL., LUDHIANA, PUNJAB",PUNJAB,14.0,24.0,4.0,4.4,7.0,7.6,502.0,1096.0,13.0,24.0,1.0,4.3,35000.0,43000.0,50000.0,64000.0
1021,"SATLUJ AT BOAT BDG. DHARMKOTNAKODAR ROAD, JALAHAR, PUNJAB",PUNJAB,15.0,26.0,5.5,8.0,7.2,7.7,351.0,714.0,4.0,10.0,0.6,2.6,280.0,14000.0,640.0,30000.0
1381,"SATLUJ AT D/S EAST BASIN, PUNJAB",PUNJAB,12.0,21.0,2.1,4.0,7.1,7.8,398.0,810.0,4.0,10.2,3.8,4.6,3000.0,7500.0,6000.0,14000.0
1691,"SATLUJ U/S HUSSANIWALA - H/W FEROZEPUR, PUNJAB",PUNJAB,16.0,25.0,7.7,8.4,7.3,8.4,260.0,275.0,1.2,2.0,0.4,1.2,110.0,210.0,280.0,390.0
1692,"SATLUJ D/S HUSSANIWALA- H/W FEROZEPUR, PUNJAB",PUNJAB,16.2,26.0,7.5,8.4,7.2,8.2,182.0,281.0,1.2,2.0,0.4,1.2,150.0,230.0,390.0,460.0
1022,"SATLUJ AT BRIDGE HARIKE, AMRITSAR, PUNJAB",PUNJAB,13.0,22.0,4.8,5.8,7.4,7.8,296.0,398.0,2.0,2.9,3.1,3.5,400.0,700.0,750.0,1100.0
1307,"CHUNT KOL  (MAULANA AZAD BRIDGE), J&K",JAMMU & KASHMIR,2.0,19.8,4.0,6.5,7.0,8.5,174.0,259.0,4.1,6.0,,,,,,
1306,"GAWKADAL, SRG (SHERGHARI, SRG), J&K",JAMMU & KASHMIR,2.0,19.0,6.5,8.3,7.1,8.2,90.0,234.0,1.0,3.0,,,,,,
1304,"JHELAM AT ANANTNAG D/S,
J&K",JAMMU & KASHMIR,7.5,19.0,5.1,8.8,7.4,8.1,165.0,356.0,1.2,3.0,,,,,,
1410,"JHELAM AT DALAGATE (INLET), SRINAGAR, J&K",JAMMU & KASHMIR,3.4,19.2,5.7,8.1,7.4,8.2,120.0,320.0,1.0,3.0,,,,,,
1411,"JHELAM AT CHATTABAL WEIR (OUTLET), J&K",JAMMU & KASHMIR,5.0,20.0,6.3,7.1,7.2,8.3,123.0,231.0,1.0,2.3,,,,,,
3272,RIVER JHELUM AT VERINAG,JAMMU & KASHMIR,3.0,18.0,5.8,6.8,7.5,7.8,100.0,160.0,0.5,1.2,,,,,,
3273,"RIVER JHELUM AT SANGAM, CONFLUENCE POINT OF VISHAV NALLAH",JAMMU & KASHMIR,6.0,19.2,5.8,8.5,7.1,8.2,140.0,320.0,1.0,2.4,,,,,,
3276,"RIVER JHELUM ATSPORE, CONFLUENCE POINT OF WULAR LAKE",JAMMU & KASHMIR,1.0,16.5,6.0,7.4,7.0,8.2,241.0,495.0,1.0,3.4,,,,,,
3277,RIVER JHELUM ATBARAMULLA D/S,JAMMU & KASHMIR,2.0,17.0,6.0,7.6,7.2,8.2,156.0,465.0,1.7,3.0,,,,,,
3274,RIVER JHELUM AT AWANTIPORA,JAMMU & KASHMIR,3.7,19.2,5.8,8.1,7.3,8.1,160.0,290.0,1.1,2.7,,,,,,
3275,RIVER JHELUM AT PAMPORE,JAMMU & KASHMIR,3.0,19.3,6.0,8.1,7.2,7.9,120.0,280.0,1.4,2.6,,,,,,
2755,"BANGANGA (BATHING GHAT), KATRA, J&K",JAMMU & KASHMIR,9.0,24.0,5.8,7.7,7.2,8.5,310.0,540.0,2.4,6.0,0.0,0.6,,,,
2756,"BANGANGA (IN FRONT OF PONY SHED NEAR REASI BRIDGE)KATRA, J&K",JAMMU & KASHMIR,9.0,24.0,5.8,8.2,7.5,8.5,300.0,540.0,2.2,6.0,0.2,0.3,,,,
2752,"SAMBA (BELOW NH-1A BRIDGE), BASANTAR US (R.H.S), J&K",JAMMU & KASHMIR,14.0,24.0,7.7,8.6,7.8,8.0,4.0,270.0,2.5,3.0,0.1,0.3,,,,
2753,"SAMBA (AT CHAK MANGA GUJJAR BASANTAR)D/S(R.H.S.),
J&K",JAMMU & KASHMIR,14.0,24.0,6.3,8.2,7.2,8.1,240.0,336.0,2.1,6.0,0.1,0.5,,,,
2748,"CHENAB AT L.H.S.(BELOW BRIDGE CHENAB), J&K",JAMMU & KASHMIR,8.0,16.0,8.7,9.7,7.2,8.6,120.0,237.0,0.0,1.0,0.0,0.1,,,,
2749,"BLI CURVE SHAMSHAN GHAT (1.5 KM U/S FROM SPOT), J&K",JAMMU & KASHMIR,8.0,16.0,8.3,9.6,7.1,8.5,120.0,214.0,0.0,1.0,0.0,0.0,,,,
2750,"CHADRA GAON VIEW POINT(4 KM U/S FROM SPOT), J&K",JAMMU & KASHMIR,8.0,16.0,8.8,9.6,7.1,8.4,122.0,245.0,0.0,1.0,0.0,0.1,,,,
2751,"JAL PATAN MAIR AFTER MEETING WITH MAIN DRAIN OF AKHNOOR CITY(1.5 KMD/S FROM SPOT, J&K",JAMMU & KASHMIR,9.0,16.0,6.6,8.2,7.3,7.4,126.0,237.0,1.5,6.0,0.1,0.4,,,,
2754,"RIVER DEVAK UDHAMPUR(NEAR SHIV MAIRD/S)L.H.S., J&K",JAMMU & KASHMIR,12.0,27.0,3.7,7.1,7.2,7.5,473.0,600.0,8.0,28.0,0.2,2.6,,,,
2757,"RIVER DEVAK AT UTTERBEHNI, J&K",JAMMU & KASHMIR,15.0,25.0,3.3,8.1,7.2,7.8,255.0,310.0,1.0,3.5,0.0,0.0,,,,
3278,LIDDER NALLAH AT LARIPORA,JAMMU & KASHMIR,1.0,14.4,7.7,9.6,7.3,8.1,91.0,174.0,0.6,1.4,0.0,0.0,,,,
3279,LIDDER NALLAH AT CLUB PARK,JAMMU & KASHMIR,1.0,14.5,7.7,9.8,7.3,7.9,48.0,178.0,0.3,2.0,0.0,0.0,,,,
3280,LIDDER NALLAH AT BUS ADDA,JAMMU & KASHMIR,1.0,14.6,6.8,9.8,7.1,8.0,79.0,174.0,0.5,2.2,0.0,0.0,,,,
3281,"LIDDER NALLAH AT YANEER, D/S OF PHALGUM",JAMMU & KASHMIR,2.0,15.0,7.8,10.0,7.2,8.0,40.0,120.0,0.5,1.2,0.0,0.0,,,,
3282,"LIDDER NALLAH NERA BUMZOO, ANANTNAG",JAMMU & KASHMIR,2.0,17.0,7.0,8.8,7.3,8.5,97.0,162.0,0.8,2.0,0.0,0.0,,,,
3283,"RIVER SINDH AT SONAMARG
U/S",JAMMU & KASHMIR,5.8,13.5,7.7,8.9,7.2,8.1,140.0,280.0,1.0,1.4,0.0,0.0,,,,
3284,"RIVER SINDH AT SONAMARG
D/S",JAMMU & KASHMIR,6.6,13.2,7.2,9.3,7.2,8.2,138.0,285.0,0.5,1.2,0.0,0.0,,,,
3285,RIVER SINDH AT WAIL BRIDGE,JAMMU & KASHMIR,1.0,14.7,6.7,9.2,7.1,8.1,78.0,234.0,0.5,1.7,0.0,0.0,,,,
3286,RIVER SINDH AT DUDERHAMA,JAMMU & KASHMIR,1.0,15.0,6.8,8.5,7.0,8.3,76.0,275.0,1.0,2.0,0.0,0.0,,,,
3287,"RIVER SINDH AT RANGIL, SRINAGAR",JAMMU & KASHMIR,2.0,14.0,6.7,9.1,7.2,8.1,87.0,271.0,0.6,1.9,0.0,0.0,,,,
2742,"SHETALI LIFTING POINT NAGROTA(5KM U/S TAWI BRIDGE), J&K",JAMMU & KASHMIR,11.0,24.0,7.7,9.2,7.3,7.8,132.0,256.0,1.0,1.5,0.0,0.1,,,,
2743,"BAGH-E-BAHU LIFTING POINT(1 KM U/S TAWI BRIDGE), J&K",JAMMU & KASHMIR,10.0,24.0,7.5,8.8,7.6,7.8,144.0,253.0,1.0,1.5,0.0,0.1,,,,
2744,"BELOW TAWI BRIDGE, J&K",JAMMU & KASHMIR,13.0,24.0,7.0,7.4,7.6,8.0,116.0,275.0,3.2,5.6,0.0,0.6,,,,
2746,"BELICHARANA(4KM D/S TAWI BRIDGE), J&K",JAMMU & KASHMIR,20.0,24.0,8.2,8.2,8.0,8.0,246.0,260.0,1.7,2.1,0.0,0.0,,,,
2745,"BAGHWATI NAGAR (2KM D/S TAWI BRIDGE), J&K",JAMMU & KASHMIR,14.0,24.0,6.5,6.6,7.7,8.0,230.0,260.0,3.9,7.0,0.0,0.7,,,,
2747,"SURAJPUR CHATHA(10 KM D/S TAWI BRIDGE)BELOW BRIDGE NEAR CHATHA MSW DUMPING SITE, J&K",JAMMU & KASHMIR,20.0,24.0,8.2,8.2,7.8,7.8,274.0,276.0,1.6,1.8,0.0,0.0,,,,
2758,"RIVER UJH AT DAM SITE(L.H.S.), KATHUA, J&K",JAMMU & KASHMIR,13.0,25.0,8.4,9.3,7.2,8.1,230.0,266.0,0.0,1.0,0.0,0.6,,,,
1491,"BHAGIRATHI AT GANGOTRI, UTTAR PRADESH",UTTRAKHAND,,,,,,,,,,,,,,,,
1484,"ALKANANDA B/C MAAKINI AT RUDRA PRAYAG, UTTAR PRADESH",UTTRAKHAND,17.0,19.0,8.4,9.2,7.7,8.0,,,1.0,1.0,0.0,0.0,,,,
1485,"MANDAKINI B/C ALKALNADA AT RUDRAPRAYAG, UTTAR PRADESH",UTTRAKHAND,16.0,18.0,9.0,9.2,7.9,8.0,,,1.0,1.0,0.0,0.0,,,,
1486,"ALKANANDA A/C MAAKINI AT RUDRAPRAYAG, UTTAR PRADESH",UTTRAKHAND,17.0,19.0,7.2,8.4,7.9,8.1,,,1.0,1.0,0.0,0.0,,,,
1487,"ALKANANDA B/C TO BHAGIRATHI AT DEVPRAYAG, UTTAR PRADESH",UTTRAKHAND,17.0,20.0,7.6,8.8,8.0,8.1,,,1.0,1.0,0.0,0.0,,,,
1488,"BHAGIRATHI B/C WITH ALAKNANDA AT DEVPRAYAG, U.P",UTTRAKHAND,18.0,19.0,9.4,9.6,8.2,8.5,,,1.0,1.0,0.0,0.0,,,,
1489,"ALKANANDA A/C WITH BHAGIRATHI AT DEVPRAYAG, UTTAR PRADESH",UTTRAKHAND,18.0,19.0,8.6,8.8,8.0,8.1,,,1.0,1.0,0.0,0.0,,,,
1060,"GANGA AT HARIDWAR D/S, U.P",UTTRAKHAND,14.0,21.0,8.6,11.2,7.1,7.8,,,0.6,1.0,0.0,0.0,,,6.0,26.0
2725,GANGA RIVER AFTER CONFLUENCE OF RIVER SONG NEAR SATYANARAYAN TEMPLE D/S RAIWALA,UTTRAKHAND,14.0,24.0,7.6,8.8,7.4,7.9,,,1.0,2.2,0.0,0.0,,,220.0,500.0
1061,"GANGA AT HARIDWAR D/S, U.P",UTTRAKHAND,14.0,22.5,8.8,11.6,7.8,8.2,,,1.0,1.8,0.0,0.0,,,500.0,900.0
2727,UPPER GANGA RIVER D/S ROORKEE,UTTRAKHAND,14.0,22.0,7.8,10.6,7.3,8.2,,,0.8,1.8,0.0,0.0,,,80.0,350.0
1062,"GANGA AT GARHMUKTESHWAR, U.P",UTTAR PRADESH,18.0,25.0,6.5,9.5,7.2,8.4,210.0,290.0,2.1,3.6,0.0,0.5,550.0,1100.0,1100.0,1500.0
2488,"GANGA U/S, ANOOPSHAHAR",UTTAR PRADESH,23.0,23.0,6.2,7.6,6.7,7.8,164.0,270.0,2.0,2.3,0.0,0.2,370.0,410.0,550.0,630.0
1145,"GANGA AT NARORA (BULASAHAR), U.P.",UTTAR PRADESH,20.0,23.0,7.1,7.8,7.1,7.5,220.0,250.0,2.3,3.5,0.0,0.2,430.0,430.0,610.0,1400.0
2490,"GANGA AT KACHHLA GHAT, ALIGARH",UTTAR PRADESH,20.0,20.0,8.0,8.8,7.1,7.6,200.0,250.0,2.0,3.5,0.0,0.1,370.0,370.0,410.0,1500.0
1063,"GANGA AT KANNAUJ U/S (RAJGHAT), U.P",UTTAR PRADESH,12.0,32.0,6.4,10.2,7.2,8.7,190.0,436.0,1.9,4.2,0.0,0.3,1400.0,2800.0,2600.0,4900.0
1066,"GANGA AT KANNAUJ D/S, U.P",UTTAR PRADESH,12.0,32.0,6.2,9.8,7.6,8.8,199.0,510.0,2.2,4.6,0.0,0.3,2100.0,3800.0,3900.0,7000.0
1146,"GANGA AT BITHOOR (KANPUR), U.P.",UTTAR PRADESH,12.0,33.0,6.6,9.8,7.4,8.8,215.0,372.0,2.1,3.2,0.0,0.3,1500.0,3100.0,2400.0,5800.0
1067,"GANGA AT KANPUR U/S (RANIGHAT), U.P",UTTAR PRADESH,12.0,33.0,6.4,10.0,7.3,8.9,238.0,402.0,2.2,4.0,0.0,0.4,2200.0,4000.0,2800.0,6300.0
1068,"GANGA AT KANPUR D/S (JAJMAU PUMPING STATION), U.P",UTTAR PRADESH,12.0,33.0,5.4,8.0,7.1,8.8,294.0,532.0,4.0,7.4,0.0,0.5,12000.0,26000.0,31000.0,84000.0
1147,"GANGA AT DALMAU (RAI BAREILLY), U.P.",UTTAR PRADESH,18.0,25.0,7.2,9.0,7.8,8.1,201.0,269.0,3.7,4.5,0.8,0.9,4900.0,6300.0,8100.0,8800.0
2498,"GANGA AT KALA KANKAR, RAEBARELI",UTTAR PRADESH,18.0,25.0,7.3,9.2,7.8,8.1,198.0,262.0,3.4,4.4,0.8,0.9,4700.0,5900.0,7700.0,8600.0
1046,"GANGA AT ALLAHABAD (RASOOLABAD), U.P.",UTTAR PRADESH,19.6,30.1,7.2,8.9,7.4,8.4,298.0,520.0,3.3,4.6,0.0,1.3,13000.0,22000.0,26000.0,35000.0
2487,"GANGA AT KADAGHAT, ALLAHABAD",UTTAR PRADESH,19.3,30.3,7.2,8.8,7.5,8.4,312.0,508.0,3.5,4.5,0.0,1.3,14000.0,24000.0,28000.0,38000.0
1049,"GANGA AT ALLAHABAD D/S (SANGAM), U.P.",UTTAR PRADESH,20.0,30.6,7.0,8.7,7.4,8.4,365.0,499.0,3.4,4.8,0.0,1.5,17000.0,26000.0,32000.0,39000.0
2485,"GANGA U/S, VIHYACHAL, MIRZAPUR",UTTAR PRADESH,19.0,30.0,7.6,8.5,7.5,7.8,352.0,387.0,2.1,2.3,0.0,0.5,1100.0,1700.0,2000.0,2800.0
2486,"GANGA D/S, MIRZAPUR",UTTAR PRADESH,19.0,28.0,8.1,8.7,7.8,7.9,366.0,412.0,2.3,2.5,0.0,0.5,1300.0,2100.0,2100.0,4000.0
1070,"GANGA AT VARANASI U/S (ASSIGHAT), U.P",UTTAR PRADESH,12.0,31.0,7.5,8.7,7.9,8.8,245.0,776.0,2.5,8.6,0.0,0.0,1400.0,3100.0,2700.0,5000.0
1071,"GANGA AT VARANASI D/S (MALVIYA BRIDGE), U.P",UTTAR PRADESH,19.0,26.0,7.0,7.8,8.4,8.8,382.0,430.0,4.2,5.3,0.0,0.0,23000.0,33000.0,40000.0,49000.0
1073,"GANGA AT TRIGHAT (GHAZIPUR), U.P",UTTAR PRADESH,19.5,26.5,7.0,8.0,8.4,8.8,380.0,412.0,3.5,4.8,0.0,0.0,22000.0,22000.0,22000.0,34000.0
2502,"SHUKRA TAL, MUZAFFARNAGAR, NEAR GANGA RIVER",UTTAR PRADESH,19.0,20.0,7.6,8.7,7.4,7.6,270.0,356.0,1.5,2.0,0.0,0.0,70.0,70.0,130.0,170.0
1074,"GANGA AT BUXAR, BIHAR",BIHAR,22.0,36.0,7.8,10.2,7.8,9.3,262.0,647.0,2.3,2.8,0.0,0.0,800.0,5000.0,2800.0,16000.0
2551,"GANGA AT BUXAR, RAMREKHAGHAT, BIHAR",BIHAR,21.0,35.0,7.7,9.8,8.0,9.3,276.0,657.0,2.5,2.9,0.0,0.0,1400.0,9000.0,5000.0,24000.0
1077,"GANGA AT KHURJI, PATNA U/S, BIHAR",BIHAR,16.0,39.0,7.4,9.3,7.9,9.2,242.0,498.0,2.0,2.9,0.0,0.0,700.0,16000.0,2200.0,24000.0
2556,"GANGA AT IRAPURI, DEHRI ON SONE, BIHAR",BIHAR,18.0,39.0,7.0,8.8,7.7,8.7,133.0,296.0,1.2,2.3,0.0,0.0,500.0,1100.0,900.0,2200.0
2564,"GANGA AT THE CONFLUENCE OF SONE RIVER DORIGANJ, CHAPRA, BIHAR",BIHAR,23.0,35.0,7.9,8.8,7.8,8.5,228.0,338.0,2.3,2.8,0.0,0.0,800.0,3000.0,2400.0,9000.0
2552,"GANGA DARBHANGA GHAT AT PATNA, BIHAR",BIHAR,16.0,40.0,7.4,8.8,7.6,9.1,256.0,559.0,2.6,3.0,0.0,0.0,2800.0,16000.0,9000.0,24000.0
1079,"GANGA AT PATNA D/S (GANGA BRIDGE), BIHAR",BIHAR,16.0,37.0,6.9,9.0,7.9,9.2,259.0,584.0,2.0,2.8,0.0,0.0,900.0,9000.0,2800.0,24000.0
2555,"GANGA AT PUNPUN, PATNA, BIHAR",BIHAR,17.0,38.0,6.8,8.8,7.2,8.7,362.0,772.0,2.2,2.6,0.0,0.0,700.0,1400.0,2200.0,5000.0
2553,"GANGA AT FATUHA, BIHAR",BIHAR,19.0,38.0,7.0,9.2,7.7,9.1,260.0,514.0,2.0,2.6,0.0,0.0,800.0,5000.0,2200.0,16000.0
1817,"GANGA AT MOKAMA (U/S), BIHAR",BIHAR,17.0,29.0,7.0,8.6,7.7,8.1,230.0,363.0,2.0,2.5,0.0,0.0,700.0,1700.0,1700.0,5000.0
1815,"GANGA AT MOKAMA (D/S), BIHAR",BIHAR,14.0,28.0,7.5,8.4,7.6,8.0,237.0,366.0,2.2,2.8,0.0,0.0,1400.0,9000.0,3000.0,24000.0
1818,"GANGA AT MUNGER, BIHAR",BIHAR,16.0,28.0,7.5,8.5,7.6,8.0,237.0,375.0,2.1,2.7,0.0,0.0,1100.0,5000.0,2400.0,16000.0
2554,"GANGA AT SULTANGANJ, BHAGALPUR, BIHAR",BIHAR,18.0,28.0,7.5,8.4,7.6,8.0,185.0,370.0,2.0,2.6,0.0,0.0,900.0,3000.0,2200.0,9000.0
1819,"GANGA AT BHAGALPUR, BIHAR",BIHAR,16.0,27.0,7.5,8.4,7.5,8.0,184.0,394.0,2.1,2.7,0.0,0.0,1100.0,5000.0,3000.0,16000.0
1816,"GANGA AT KAHALGAON, BIHAR",BIHAR,16.0,28.0,7.6,8.6,7.8,8.1,251.0,395.0,2.4,2.8,0.0,0.0,1300.0,5000.0,3000.0,16000.0
3113,"GANGA AT D/S BUXAR NEAR GANGA BRIDGE, BIHAR",BIHAR,22.0,39.0,7.8,9.8,8.0,9.3,272.0,586.0,2.0,2.7,0.0,0.0,800.0,5000.0,2200.0,16000.0
3114,"GANGA NEAR DANAPUR (NEAR PIPA PUL), BIHAR",BIHAR,16.0,38.0,7.6,9.4,7.5,9.2,246.0,492.0,2.0,2.6,0.0,0.0,500.0,1700.0,1700.0,5000.0
3115,"GANGA RIVER AT BARH, BIHAR",BIHAR,18.0,30.0,7.8,8.0,7.8,8.1,235.0,335.0,2.0,2.6,0.0,0.0,700.0,1700.0,1400.0,9000.0
3116,"GANGA AT U/S MUNGER (NEAR INTAKE WELL ON GANGA), BIHAR",BIHAR,18.0,28.0,7.6,8.5,7.8,8.0,238.0,378.0,2.0,2.3,0.0,0.0,500.0,1300.0,1300.0,8000.0
3117,"GANGA AT U/S SULATANGANJ, BIHAR",BIHAR,18.0,28.0,7.6,8.5,7.7,8.0,185.0,364.0,2.0,2.5,0.0,0.0,500.0,1400.0,1400.0,5000.0
3122,"GANGA AT MALSALAMI, PATNA, BIHAR",BIHAR,16.0,37.0,7.2,9.3,3.2,9.2,268.0,584.0,2.0,2.7,0.0,0.0,800.0,3000.0,2200.0,9000.0
3123,"GANGA RIVER AT BARAHIA, BIHAR",BIHAR,16.0,28.0,6.9,8.6,7.7,8.1,235.0,372.0,1.8,2.5,0.0,0.0,700.0,1700.0,1700.0,3500.0
3118,"GANGA AT U/S BHAGALPUR, BIHAR",BIHAR,16.0,28.0,7.6,8.5,7.9,8.1,193.0,388.0,2.0,2.5,0.0,0.0,800.0,2200.0,1700.0,9000.0
1080,GANGA AT BAHARAMPORE WEST BENGAL,WEST BENGAL,19.0,32.0,3.8,9.8,7.5,8.3,213.0,422.0,0.4,7.2,0.6,2.2,8000.0,140000.0,13000.0,280000.0
2511,"NABADIP ON GANGA,GHOSHPARA NEAR MONIPURGHAT",WEST BENGAL,19.0,32.0,5.2,9.5,7.6,8.6,153.0,433.0,1.3,4.9,0.1,1.7,13000.0,110000.0,23000.0,140000.0
2506,"TRIBENI ON GANGA, NEAR BURNING GHAT",WEST BENGAL,20.0,33.0,3.3,9.8,7.8,8.6,167.0,362.0,1.4,16.0,0.2,1.9,7000.0,80000.0,11000.0,140000.0
1054,GANGA AT PALTA WEST BENGAL,WEST BENGAL,20.0,34.0,4.1,8.5,7.8,8.5,175.0,365.0,1.8,6.6,0.1,2.1,17000.0,140000.0,30000.0,220000.0
1472,GANGA AT SERAMPORE WEST BENGAL,WEST BENGAL,20.0,33.0,3.6,8.9,7.6,8.5,199.0,358.0,1.2,6.4,0.2,1.0,50000.0,240000.0,70000.0,300000.0
1053,GANGA AT DAKSHINESHWAR WEST BENGAL,WEST BENGAL,19.0,33.0,4.5,9.7,7.7,8.5,177.0,367.0,2.9,8.4,0.0,0.5,50000.0,400000.0,110000.0,650000.0
1471,"GANGA AT HOWRAH-SHIVPUR, WEST BENGAL",WEST BENGAL,18.0,33.0,4.2,10.2,7.6,8.4,208.0,355.0,1.0,5.6,0.2,1.0,22000.0,240000.0,50000.0,500000.0
1470,"GANGA AT GARDEN REACH, WEST BENGAL",WEST BENGAL,20.0,34.0,3.0,9.2,7.5,8.2,212.0,374.0,1.2,7.1,0.2,0.8,65000.0,700000.0,115000.0,1400000.0
1052,GANGA AT ULUBERIA WEST BENGAL,WEST BENGAL,19.0,34.0,2.9,8.6,7.4,8.5,225.0,1018.0,1.2,5.1,0.2,0.5,4000.0,240000.0,13000.0,500000.0
1469,"GANGA AT DIAMOND HARBOUR, WEST BENGAL",WEST BENGAL,21.0,33.0,4.2,8.1,7.8,8.4,235.0,6250.0,1.2,11.0,0.0,0.8,4000.0,70000.0,8000.0,170000.0
2724,"SUSWA RIVER AT MOTHRAWALA, DEHRADUN",UTTARAKHAND,14.0,23.0,1.0,5.6,7.6,8.1,,,12.0,38.0,0.0,0.0,,,1600.0,1600.0
2734,BHALLA RIVER U/S KASHIPUR,UTTARAKHAND,12.0,32.0,2.6,8.4,7.0,7.2,162.0,347.0,4.0,10.2,0.0,0.0,,,,
2735,BHALLA RIVER AT LOHIA BRIDGE D/S KASHIPUR,UTTARAKHAND,12.0,34.0,0.0,1.2,6.8,7.3,467.0,1026.0,16.0,146.0,0.0,0.0,,,,
2732,DHELA RIVER U/S AT KASHIPUR MORADABAD ROAD BRIDGE,UTTARAKHAND,12.0,33.0,4.0,6.6,7.0,7.4,272.0,472.0,6.0,22.0,0.0,0.0,,,,
2733,DHELA RIVER D/S AT THAKURDWARA ALIGANJ ROAD,UTTARAKHAND,12.0,34.0,0.0,4.0,7.3,7.6,432.0,1198.0,12.0,62.0,0.0,0.0,,,,
2731,KOSI RIVER AT KASHIPUR BAJPUR ROAD BRIDGE,UTTARAKHAND,12.0,32.0,6.4,8.4,7.0,7.2,242.0,396.0,2.0,10.6,0.0,0.0,,,,
1064,"RAMGANGA AT KANNAUJ (BEFORE CONF.), U.P",UTTAR PRADESH,12.0,32.0,5.2,12.2,7.2,9.8,257.0,559.0,3.0,7.7,0.0,0.4,2100.0,4100.0,3800.0,6300.0
2497,"RIVER KALI EAST AT KHARKHODA-PARIKSHIT GARH ROAD, VILL. KOL, MEERUT",UTTAR PRADESH,20.0,23.0,0.0,0.0,7.2,7.6,1750.0,1980.0,62.0,70.0,0.0,6.4,94000.0,210000.0,120000.0,280000.0
1065,"KALINADI AT KANNAUJ (BEFORE CONF.), U.P",UTTAR PRADESH,12.0,32.0,5.8,9.0,7.3,8.8,196.0,703.0,2.8,4.8,0.0,0.4,1700.0,3400.0,3300.0,5800.0
2482,"RIVER VARUNA AT RAMESHWAR, VARANASI",UTTAR PRADESH,20.0,26.5,7.4,8.7,7.7,8.3,332.0,354.0,2.6,3.2,0.0,0.0,1700.0,8000.0,2600.0,11000.0
2483,RIVER VARUNA B/C WITH RIVER GANGA AT VARANASI,UTTAR PRADESH,20.0,26.5,1.7,3.5,8.5,8.9,438.0,465.0,22.4,45.6,0.0,0.0,110000.0,130000.0,180000.0,320000.0
1361,"SAI AT UNNAO AFTER DRAIN OUTFALL, U.P.",UTTAR PRADESH,16.0,36.0,6.3,8.9,7.0,7.3,335.0,448.0,2.8,3.8,0.0,0.1,200.0,2400.0,3100.0,4700.0
2484,"RIVER SAI AT JALALPUR, JAUNPUR",UTTAR PRADESH,20.0,26.5,7.4,8.2,7.8,8.3,346.0,370.0,3.1,3.6,0.0,0.0,5000.0,11000.0,11000.0,14000.0
1350,"GOMTI AT SITAPUR U/S AT WATER INTAKE, U.P.",UTTAR PRADESH,22.2,31.0,5.0,11.0,7.9,8.7,224.0,410.0,2.4,2.9,0.0,2.3,110.0,170.0,700.0,1700.0
1351,"GOMTI AT LUCKNOW U/S AT WATER INTAKE POINT, U.P.",UTTAR PRADESH,22.0,31.1,5.7,9.7,7.3,8.6,246.0,418.0,3.1,3.7,0.0,2.1,330.0,3300.0,2400.0,4600.0
1352,"GOMTI AT LUCKNOW D/S, U.P.",UTTAR PRADESH,22.0,31.7,0.3,2.0,7.1,7.8,280.0,504.0,9.5,12.5,0.0,3.8,70000.0,110000.0,12000.0,140000.0
1353,"GOMTI AT JAUNPUR D/S, U.P.",UTTAR PRADESH,19.0,26.5,7.3,8.2,8.2,8.4,358.0,398.0,3.2,4.2,0.0,0.0,11000.0,17000.0,14000.0,31000.0
1072,"GOMTI AT VARANASI, U.P",UTTAR PRADESH,20.0,25.5,7.4,8.5,7.7,8.3,354.0,372.0,3.0,3.5,0.0,0.0,11000.0,13000.0,13000.0,17000.0
2491,"RIVER RAPTI AT RAJGHAT, GORAKHPUR",UTTAR PRADESH,12.0,28.0,7.1,7.8,7.9,811.0,432.0,596.0,3.1,7.6,0.3,0.8,330.0,5000.0,700.0,8000.0
1363,"RAPTI AFTER CONFL. OF R. HONIN NR. DOMINGARH RLY BRIDGE, GORAKHPUR, U.P.",UTTAR PRADESH,10.0,28.0,7.2,7.9,8.0,8.2,384.0,490.0,2.4,3.2,0.2,0.5,140.0,600.0,300.0,1300.0
1354,"SARYU AT AYODHYA AT MAIN BATHING GHAT, U.P.",UTTAR PRADESH,17.0,23.0,8.1,9.8,7.7,7.9,177.0,249.0,2.5,3.3,0.7,0.8,4100.0,5400.0,7000.0,7900.0
1355,"GHAGHARA AT DEORIA D/S, U.P.",UTTAR PRADESH,13.0,30.0,7.3,7.9,8.0,8.2,410.0,538.0,2.5,3.4,0.3,0.5,140.0,800.0,300.0,1300.0
2492,"RIVER GHAGHRA AT BARHALGANJ, GORAKHPUR",UTTAR PRADESH,12.0,29.0,7.2,7.8,7.9,8.2,490.0,614.0,3.2,4.4,0.3,0.7,500.0,2800.0,1300.0,5000.0
1076,"GHAGHARA NEAR CHAPRA, BIHAR",BIHAR,23.0,36.0,7.7,8.8,7.9,8.6,236.0,430.0,1.5,2.3,0.0,0.0,500.0,1300.0,1300.0,3000.0
1359,"RIHAND AT RENUKUT U/S, U.P.",UTTAR PRADESH,20.4,31.0,7.2,8.2,7.3,8.2,235.0,324.0,1.2,2.4,0.0,0.5,780.0,1400.0,1700.0,2500.0
1360,"RIHAND AT RENUKUT D/S, U.P.",UTTAR PRADESH,20.5,31.1,7.4,8.3,7.3,8.3,254.0,338.0,1.4,2.2,0.0,0.4,1100.0,1700.0,2000.0,2800.0
1075,"SONE AT KOELWAR, BIHAR",BIHAR,23.0,35.0,7.4,8.9,7.6,9.0,208.0,342.0,1.2,2.2,0.0,0.0,300.0,800.0,800.0,2200.0
3121,"SONE RIVER NEAR BANZARI, BIHAR",BIHAR,18.0,32.0,7.2,9.0,7.7,8.9,127.0,540.0,1.1,2.2,0.0,0.0,300.0,800.0,700.0,1700.0
3127,"SONE RIVER AT BAHIYARA, BIHAR",BIHAR,23.0,34.0,7.6,9.0,7.5,9.0,206.0,334.0,1.2,2.0,0.0,0.0,300.0,700.0,700.0,1700.0
3128,"SONE RIVER AT NASIRIGANJ DAM, BIHAR",BIHAR,20.0,36.0,7.0,8.8,7.6,8.7,139.0,976.0,1.1,2.3,0.0,0.0,500.0,1300.0,1100.0,3000.0
1078,"GANDAK AT SONEPUR, PATNA (BEFORE CONFL.), BIHAR",BIHAR,18.0,35.0,7.8,10.2,7.9,8.9,225.0,310.0,1.2,2.4,0.0,0.0,500.0,1100.0,1100.0,2800.0
2568,"GANDAK AT REWAGHAT, MUJAFFARPUR, BIHAR",BIHAR,18.0,36.0,7.9,9.5,5.5,8.8,236.0,321.0,1.3,2.6,0.0,0.0,300.0,900.0,700.0,2800.0
2570,"GANDAK AT SAMASTIPUR ROAD BRIDGE, BIHAR",BIHAR,20.0,32.0,7.4,9.2,8.0,9.1,262.0,481.0,1.8,2.6,0.0,0.0,500.0,1700.0,1300.0,3000.0
3124,"GANDAK RIVER U/S ROAD BRIDGE MUZAFFARPUR (NH), BIHAR",BIHAR,19.0,34.0,7.2,8.8,8.1,8.8,327.0,485.0,1.9,2.2,0.0,0.0,700.0,900.0,1700.0,2200.0
3125,"GANDAK RIVER GOPALGANJ PIPRAKOTHI ROAD BRIDGE (DUMARIA GHAT), BIHAR",BIHAR,22.0,36.0,7.8,10.0,7.9,8.9,236.0,967.0,1.3,2.3,0.0,0.0,500.0,1300.0,80.0,3000.0
2575,"SIKRAHANA RIVER AT LAL PARSE, BITTIAH, BIHAR",BIHAR,19.0,30.0,7.2,8.5,7.7,8.4,261.0,456.0,2.1,2.7,0.0,0.0,800.0,1400.0,2800.0,28000.0
1820,"SIKRAHANA AT CHANPATIYA, BIHAR",BIHAR,18.0,32.0,1.8,8.2,7.4,8.3,270.0,835.0,2.4,15.0,0.0,0.0,1100.0,3000.0,2400.0,9000.0
3134,"SIKRAHANA RIVER AT LAUREA, HARINAGAR ROAD BRIDGE, BIHAR",BIHAR,16.0,29.0,3.2,8.4,6.9,8.3,267.0,497.0,2.0,20.0,,,800.0,5000.0,2200.0,16000.0
2562,"BURHI GANDAK AT AKHARAGHAT, MUZAFFARPUR, BIHAR",BIHAR,19.0,34.0,7.2,8.6,8.0,8.9,362.0,475.0,1.8,2.7,,,1100.0,5000.0,3000.0,16000.0
2558,"HARBORA RIVER AT NARKATIAGANJ, BIHAR",BIHAR,17.0,30.0,2.0,7.6,7.0,8.4,286.0,526.0,2.6,6.0,,,1100.0,3000.0,2800.0,9000.0
3126,"U/S HARBORA RIVER, BIHAR",BIHAR,15.0,30.0,4.5,9.7,7.3,8.5,273.0,466.0,1.5,3.2,,,300.0,800.0,800.0,2800.0
2567,"KAMALA RIVER AT BENIPATTI (MADHUBANI), BIHAR",BIHAR,20.0,35.0,7.4,8.6,8.0,8.9,319.0,455.0,1.1,2.0,,,300.0,700.0,700.0,1700.0
2569,"KAMALA RIVER AT DARBHANGA, BIHAR",BIHAR,20.0,30.0,6.8,8.6,7.5,8.9,186.0,412.0,1.2,2.3,,,500.0,1100.0,1300.0,2800.0
3133,"KAMALA RIVER AT JAYNAGAR, BIHAR",BIHAR,20.0,32.0,7.6,8.8,8.1,9.2,266.0,449.0,1.0,2.8,,,300.0,800.0,700.0,1400.0
2563,"MANUSMAR RIVER AT RIGA, SITAMARHI, BIHAR",BIHAR,17.0,31.0,5.5,7.9,6.8,8.7,334.0,487.0,2.6,3.8,,,1300.0,2800.0,2400.0,9000.0
2565,"KOSHI RIVER AT KURSHELA AT KATIHAR, BIHAR",BIHAR,16.0,30.0,6.5,8.0,7.5,7.6,107.0,445.0,1.4,2.4,,,500.0,1700.0,1300.0,5000.0
2566,"KOSHI RIVER AT MADHEPURA, BIHAR",BIHAR,25.0,26.0,6.5,7.0,7.4,7.5,113.0,147.0,2.6,2.8,,,800.0,1400.0,2400.0,3500.0
3137,"KOSHI RIVER AT BEERPUR, BIHAR",BIHAR,24.0,30.0,6.4,7.3,7.4,7.7,107.0,442.0,1.5,2.6,,,500.0,1700.0,1400.0,5000.0
1821,"DAHA AT SIWAN, BIHAR",BIHAR,24.0,35.0,6.6,7.8,7.9,8.4,306.0,572.0,2.4,2.6,,,900.0,3000.0,2200.0,9000.0
2560,"D/S DAHA RIVER AT SASAMUSA, BIHAR",BIHAR,17.0,34.0,6.0,8.1,7.0,8.5,359.0,616.0,2.5,2.8,,,1100.0,3000.0,3000.0,9000.0
2561,"DAHA RIVER AT ITWA BRIDGE, SIWAN, BIHAR",BIHAR,18.0,34.0,6.9,8.4,7.8,8.7,312.0,536.0,1.9,2.5,,,800.0,1700.0,2200.0,5000.0
3129,"DAHA RIVER AT MEERGANJ, BIHAR",BIHAR,24.0,35.0,6.9,8.2,7.8,8.7,326.0,535.0,1.8,2.4,,,700.0,1300.0,1700.0,5000.0
1823,"DHOUS AT MADHUBANI, BIHAR",BIHAR,20.0,34.0,7.0,8.4,8.0,8.6,271.0,376.0,2.0,2.9,,,800.0,9000.0,3000.0,24000.0
1824,"FARMAR AT JOGBANI, BIHAR",BIHAR,18.0,30.0,6.4,72.0,7.2,7.7,89.5,293.0,2.0,2.8,,,800.0,3000.0,2800.0,9000.0
2559,"RAM REKHA RIVER AT HARINAGAR, BIHAR",BIHAR,19.0,30.0,2.0,7.5,6.7,8.4,286.0,509.0,2.5,8.0,,,1700.0,9000.0,5000.0,24000.0
3130,"RAMREKHA RIVER AT U/S HARINAGAR, BIHAR",BIHAR,18.0,30.0,5.7,8.4,7.1,8.2,276.0,413.0,2.0,3.6,,,700.0,1100.0,2200.0,3000.0
3132,"BAGMATI RIVER AT MUZAFFARPUR- SITAMARHI ROAD BRIDGE, BIHAR",BIHAR,18.0,30.0,7.0,9.4,8.1,8.7,214.0,363.0,1.4,2.3,,,500.0,900.0,1100.0,2800.0
