Station Code,Location,State,Temp Min,Temp Max,Dissoved Oxygen Min,Dissoved Oxygen Max,pH Min,pH Max,Conductivity Min,Conductivity Max,BOD Min,BOD Max,Nitrate Min,Nitrate Max,Fecal Coliform Min,Fecal Coliform Max,Total Coliform Min,Total Coliform Max
2383.0,DAMODAR U/S JAMADOBA WATER WORKS,JHARKHAND,19,31,7.5,7.8,7.2,7.6,-,-,BDL,1.5,-,-,-,-,-,-
2384.0,DAMODAR AT DOMGARH WATER WORKS D/S SINDRI,JHARKHAND,18,33,7.5,7.7,7.3,7.6,-,-,BDL,2.2,-,-,-,-,-,-
2391.0,DAMODAR AT PANCHET DAM,JHARKHAND,16,36,7.5,7.7,7.4,7.8,,,BDL,1.4,,,,,,
1331.0,"DAMODAR AT DISHERGARH VILL.(NR.BIHAR-WEST BENGAL BORDER) , BURDWAN",WEST BENGAL,22,30,7.7,8.9,7.19,8.11,134,293,1.75,2.55,BDL,0.65,1400,4800,3100,8400
1332.0,"DAMODAR AT D/S OF IISCO AFTER 3RD OUTFALL AT DHENNA VILLAGE, BURDWAN,WEST BENGAL",WEST BENGAL,21,31,7.7,8.8,7.24,8.09,143,327,1.4,2.45,BDL,0.33,2200,3900,3800,6300
1333.0,"DAMODAR AT NARAINPUR AFTER CONFL. OF NUNIA NALLAH, BURDWAN,WEST BENGAL",WEST BENGAL,21,32,7.5,9.0,7.28,8.29,194,367,1.9,2.7,BDL,0.47,1000,3200,1700,5800
1334.0,"DAMODAR NEAR MUJHER MANA VILLAGE AFTER CONF. OF TAMLA NALLAH, BURDWAN",WEST BENGAL,18,31.5,6.9,7.9,7.06,8.14,240,516,2.6,3.9,BDL,0.4,3900,7900,6300,12000
10107.0,"RIVER DAMODAR AT ANDAL U/S, BURDWAN",WEST BENGAL,20,32,7.3,8.8,7.26,8.15,190,338,1.6,2.9,BDL,1,1100,3300,1700,4700
10108.0,"RIVER DAMODAR AT ANDAL D/S, BURDWAN",WEST BENGAL,20,31,7.2,8.4,7.38,8.22,186,306,1.6,2.35,BDL,0.7,1200,2700,1700,4700
10109.0,"RIVER DAMODAR AT ASANSOL U/S, BURDWAN",WEST BENGAL,22,30,8.0,9.0,7.55,8.24,140,288,1.5,2.55,BDL,0.3,1700,3400,2600,4700
10110.0,"RIVER DAMODAR AT DURGAPUR U/S, BURDWAN",WEST BENGAL,21,31,7.3,8.5,7.37,8.45,194,322,1.5,2.5,BDL,0.4,1300,3100,2000,6300
10111.0,"RIVER DAMODAR AT RANIGANJ D/S, BURDWAN",WEST BENGAL,21.5,32,7.5,8.7,7.21,8.14,273,373,1.5,2.75,BDL,0.3,1700,4300,3100,7000
2527.0,"WATER INTAKE POINT FOR BURDWAN TOWN,",WEST BENGAL,21.5,33.5,8.0,8.5,7.4,8.6,191,372,1.8,2.85,BDL,0.4,1700,3300,2400,4600
1764.0,"CHURNI D/S OF RANAGHAT TOWN,",WEST BENGAL,19,32,1.0,6.5,7.64,8.17,279,718,2,9.45,BDL,0.62,1700,800000,14000,13000000
2518.0,"CHURNI, MAJHADIA, NADIA",WEST BENGAL,19,33,0.4,4.0,7.58,8.15,235,689,1.1,7.13,0.39,0.63,450,160000,780,300000
2541.0,"WATER INTAKE POINT FOR BANKURA TOWN ON
RIVER DWARAKESHWAR, BANKURA",WEST BENGAL,18.5,35,7.9,8.6,7.48,8.19,174,368,1.8,3.3,BDL,0.5,1100,3100,1400,4300
2531.0,"U/S OF TARAPITH ON RIVER DWARKA AT SADHAK BAMDEB GHAT, BIRBHUM",WEST BENGAL,20,32.5,6.9,7.9,7.46,8.16,111,246,2.8,3.85,BDL,0.4,3300,24000,5800,35000
2532.0,"D/S OF TARAPITH ON RIVER DWARKA, SATIGHAT",WEST BENGAL,19,32,6.7,7.5,7.06,7.94,116,267,3.1,4.2,BDL,0.4,3900,54000,12000,92000
2514.0,"JALANGI, D/S OF KRISHNA NAGAR, NADIA",WEST BENGAL,19,33,2.2,10.9,7.66,8.27,253,635,1.35,6.35,BDL,0.61,200,14000,800,17000
1337.0,"RUPNARAYAN BEFORE CONFL. TO RIVER GANGA NEAR GEONKHALI,MEDINIPORE, WEST BENGAL",WEST BENGAL,20,32,6.0,8.7,6.71,8.29,266,3045,BDL,2.8,1.06,6.05,2200,8400,7900,17000
2509.0,"D/S OF RUPNARAYAN AT KOLAGHAT, NEAR KOLAGHAT RAIL BRIDGE NO.3,MEDINIPORE",WEST BENGAL,21,31,5.1,9.2,7.02,8.05,201,2533,BDL,3.3,0.88,3.2,4100,9400,11000,130000
2531.0,"U/S OF TARAPITH ON RIVER DWARKA AT SADHAK BAMDEB GHAT, BIRBHUM",WEST BENGAL,24,32.5,6.9,7.6,7.46,8.16,111,246,2.85,3.85,0.08,0.204,3300,24000,5800,35000
2532.0,"D/S OF TARAPITH ON RIVER DWARKA, SATIGHAT",WEST BENGAL,24,32,6.7,7.5,7.21,7.94,116,267,3.15,4.2,0.08,0.211,3900,54000,12000,92000
2541.0,"WATER INTAKE POINT FOR BANKURA TOWN ON
RIVER DWARAKESHWAR, BANKURA",WEST BENGAL,18.5,35,8.0,8.6,7.54,8.19,174,368,2.7,3.3,0.098,0.497,1700,3100,2400,4300
,,,MIN,MAX,MIN,MAX,MIN,MAX,MIN,MAX,MIN,MAX,MIN,MAX,MIN,MAX,MIN,MAX
1030.0,"BRAHAMPUTRA AT DIBRUGARH, ASSAM",ASSAM,20,25,6.8,9.9,7,8.1,134,203,1.3,2.1,0.5,1.6,300,910,720,2100
1262.0,"BRAHAMPUTRA AT NIMATIGHAT, ASSAM",ASSAM,16,27,6.1,8,7.3,7.8,146,172,1,2.8,0.3,1.4,2,360,300,910
1526.0,"BRAHMPUTRA RIVER AT DHENUKHAPAHAR,",ASSAM,19,30,6.6,8,7.2,7.9,127,150,1.1,2.2,0.4,1.4,300,1500,910,3500
1031.0,"BRAHAMPUTRA AT PANDU, ASSAM",ASSAM,17,30,6.6,10.3,7,8.1,108,156,1.6,1.8,0.6,1.2,300,1400,720,2800
1299.0,"BRAHAMPUTRA AT JOGIJHOGA NEAR BRIDGE,",ASSAM,20,30,5.1,7.7,7,8,153,174,1.2,2,0.7,1.4,300,1500,360,2800
2069.0,BRAHMPUTRA RIVER NEAR WATER INTAKE POINT AT KACHAR,ASSAM,20,33,6.1,10.4,7.3,8,97,186,1.3,2.6,0.5,1.6,360,1100,1100,2700
2064.0,"BRAHMAPUTRA RIVER AT CHANDRAPUR, GUWAHATI, ASSAM",ASSAM,20,33,5.2,10.2,7,7.8,108,188,1.2,2.8,0.6,1.4,300,910,720,2100
2067.0,"BRAHMPUTRA RIVER AT SUALKUCHI, DIST. KAMRUP, ASSAM",ASSAM,18,30,6.8,10.8,7,8.2,115,189,1.5,2.8,0.7,2,300,730,1100,2100
2066.0,"BRAHMAPUTRA RIVER AT DHUBRI, ASSAM",ASSAM,22,35,5.2,7.3,6.8,7.7,156,211,1.6,2.4,0.6,1.2,360,1100,730,2800
3781.0,"BRAHAMPUTRA RIVER AT BOGIBEEL BRIDGE,
BOGIBEEL, DIGBOI",ASSAM,19,26,5.6,8.7,7.2,7.8,117,157,1.6,2.6,0.4,1.4,300,730,700,1500
4004.0,BRAHAMPUTRA RIVER AT BISWANATH GHAT,ASSAM,17,30,7.2,7.8,7.2,8,146,208,1.4,2.3,0.6,1.4,300,1100,1100,2800
1422.0,"BURHIDIHING AT MARGHERITA, ASSAM",ASSAM,21,25,5.6,9.5,7,7.8,114,228,1.2,2.1,0.6,1.2,300,910,360,2000
2062.0,"BURHIDIHING NEAR DULIAJAN AT D/S, TINSUKIA,",ASSAM,20.0,28.0,6.2,9.0,7.0,8.1,151,186,1,2.2,0.3,1.8,300,910,720,2100
2230.0,"BURHIDIHING RIVER AT DULIAJAN (INTAKE POINT OF
OIL",ASSAM,20.0,26.0,5.9,7.7,7.4,8.1,160,196,1.1,2.4,BDL,1.4,300,910,360,1500
1796.0,DHANSIRI AT FULL NAGARJAN,NAGALAND,17.9,31.0,0.4,8.8,7.2,8.2,97,229,1.4,2.4,BDL,2.4,-,-,-,-
1797.0,"DHANSIRI AT BRIDGE NEAR PURANA BAZAAR,
NAGALAND",NAGALAND,18.0,31.0,5.0,9.2,7.0,8.2,74,300,1.8,2.6,BDL,1.8,-,-,-,-
1800.0,DHANSIRI AT NUTON BASTI,NAGALAND,16.6,29.8,1.4,4.8,6.7,7.9,102,302,1.9,6.2,BDL,2.2,-,-,-,-
1798.0,"DHANSIRI AT NEAR CHECK GATE (DIMAPUR
KHUTKHUTI ROA",NAGALAND,17.8,32.0,4.8,6.8,7.1,7.8,100,254,1.8,2.9,BDL,1.4,-,-,-,-
1259.0,"DHANSIRI AT GOLAGHAT, ASSAM",ASSAM,20.0,32.0,5.8,10.0,7.0,7.7,103,130,1.7,2.1,0.3,1.3,300,1100,720,2100
1799.0,"DHANSIRI AT TOWN BOUNDARY BRIDGE (DIPHU
ROAD)",NAGALAND,15.1,30.2,4.4,6.2,7.0,8.4,59,198,1.1,2.1,BDL,1.7,-,-,-,-
1928.0,"DHANSIRI AT NAGALAND-ASSAM BORDER,
DIMAPUR",NAGALAND,18.7,31.2,4.5,7.7,6.7,8.1,99,251,2,3.5,BDL,1.9,-,-,-,-
3764.0,"DHANSIRI RIVER NEAR BRIDGE AT NH-15, DHANSIRI
BHALUKMARI JUNGLE, UDALGIRI",ASSAM,19.0,28.0,6.2,7.3,7.2,7.7,95,128,1.2,2.1,0.3,1.7,300,730,720,1500
3792.0,DHANSIRI RIVER AT JAHAIGHAT,ASSAM,20.0,32.0,6.6,10.3,7.2,7.7,133,162,1.6,2.2,0.4,1.0,300,730,720,2000
3759.0,"DIKRONG RIVER NEAR BRIDGE AT NH-52,
BANDARDEWA",ASSAM,19.0,36.0,5.4,7.1,6.9,8.0,113,138,1.3,2.0,0.7,1.2,300,730,720,2000
3786.0,"GAI NADI/ RIVER AT SOMARAJAN, DHEMAJI",ASSAM,19.0,25.0,5.2,8.0,7.0,7.8,165,196,1.2,2.1,0.6,1.4,300,730,700,2000
3807.0,DIGARU RIVER AT NH CROSSING,ASSAM,19.0,30.0,6.5,9.8,7.0,7.7,47,96,1.4,2.2,0.6,1.1,300,1500,1100,3500
1530.0,"DIGBOI RIVER AT LAKHIPATHE, RESERVE FOREST, DIGBOI",ASSAM,21.0,26.0,1.4,6.8,7.0,7.8,271,300,2.2,2.8,1,2.1,610,1100,1100,2800
2231.0,"DIKHOW RIVER AT DIKHOW BRIDGE SIVASAGAR,",ASSAM,18.0,31.0,5.4,7.8,7.3,8.0,156,234,BDL,2.1,0.3,1.3,2,360,300,930
3776.0,DIKHOW RIVER AT NAGINI MORA (INTER-STATE BOUNDARIE,ASSAM,17.0,29.0,6.2,7.8,7.1,7.8,126,245,1.2,1.9,0.3,1.4,2,360,2,930
3778.0,DIKHOW RIVER AT DIKHOMUKH CONFLUENCE WITH BRAHAMPU,ASSAM,20.0,28.0,5.7,8.8,7.0,8.1,158,180,1.3,2.1,0.3,1.2,300,910,720,2100
3821.0,"DIPLAI BEEL AT SILGARA, KOKRAJHAR",ASSAM,21.0,34.0,4.1,5.1,7.1,7.5,43,57,1.2,2.4,0.6,0.9,300,730,360,1400
1298.0,"DISANG AT GUNDAMGHAT, ASSAM",ASSAM,16.0,28.0,5.1,7.9,6.8,7.7,172,210,BDL,2.1,0.6,2.1,2,300,2,730
2058.0,"DISANG RIVER AT DILLIGHAT, DIBRUGARH DIST.,",ASSAM,19.0,26.0,5.2,9.2,7.0,8.1,131,152,1.1,2.2,0.7,1.6,300,1100,720,2700
4005.0,DISANG RIVER AT NH CROSSING,ASSAM,18.0,29.0,5.4,7.7,7.2,7.8,90,206,BDL,1.9,0.7,1.9,2,360,300,730
4331.0,"DOWNSTREAM OF DHATESHWARI RIVER AT
HAILAKANDI",ASSAM,22.0,25.0,5.1,5.6,6.8,7.6,126,157,1.9,2.3,0.6,1.2,300,910,1100,2100
4332.0,DEMOW RIVER DEMOW TOWN,ASSAM,18.0,29.0,5.2,7.5,6.9,7.6,116,200,BDL,2.3,0.4,1.3,2,720,2,1100
4336.0,"BORSILA RIVER AT BORSILA, DEOPANI, NAMTI",ASSAM,15.0,30.0,5.3,8.2,6.9,7.5,54,90,BDL,2.2,0.5,1.2,2,300,2,910
4341.0,"BARNADI RIVER NEAR BRIDGE, NH-52, DUMUNICHOWKI KAM",ASSAM,18.0,35.0,5.7,10.1,7.0,8.2,81,144,1.3,2.0,0.6,1.2,300,730,600,2100
4342.0,"BARALIA RIVER (NEAR CHATPUJA GHAT) RANGIA, KAMRUP",ASSAM,19.0,34.0,6.1,10.2,7.0,8.2,90,176,1.2,2.2,0.5,1.0,300,1100,730,2800
4343.0,BURADIA RIVER (NEAR BRIDGE ALONG NH-31) NALBARI,ASSAM,18.0,34.0,5.3,10.1,7.0,8.1,131,160,1.3,1.9,0.5,1.8,300,730,720,2700
4344.0,"TIHU RIVER (NEAR BRIDGE ALONG NH-31) TIHU, NALBARI",ASSAM,18.0,32.0,5.9,11.6,7.2,8.2,138,177,1.2,1.8,0.5,1.4,300,910,1100,2700
4345.0,"SINGRA RIVER (NEAR BRIDGE ALONG NH-37) BOKO, KAMRUP (R)",ASSAM,20.0,35.0,6.5,10.6,7.0,7.8,48,70,1.5,1.8,0.4,1.1,300,730,720,2000
3380.0,DAMRING RIVER (KRISHNEI RIVER) AT RESUBELPARA,MEGHALAYA,17.0,31.5,7.0,7.8,7.1,7.4,28,78,1.3,2.0,0.37,0.52,22,79,170,420
3381.0,"MANDA RIVER (DUDHAI RIVER) AT JAMPA,",MEGHALAYA,17.0,30.4,7.0,7.9,6.7,7.3,50,80,1.2,1.9,0.33,0.47,14,49,140,320
3382.0,MANDA RIVER (DUDHAI RIVER) AT WAGAISI,MEGHALAYA,17.0,31.5,7.0,8.3,7.1,7.7,58,88,1,1.8,0.32,0.78,12,58,110,320
1802.0,DIKCHU B/c WITH TEESTA NEAR NHPC HYDROELECTRIC POW,SIKKIM,15.0,21.0,8.5,12.0,6.5,7.1,165,280,1,2.2,1.2,2.5,30,55,95,135
1930.0,DZU D/S KOHIMA TOWN,NAGALAND,14.4,28.0,5.1,6.8,7.6,8.5,142,586,1.8,2.9,BDL,2.4,-,-,-,-
1929.0,"CHATHE AT MEDZIPHEMA, DIMAPUR",NAGALAND,14.5,30.8,5.4,7.4,7.2,8.3,80,185,1.4,2.7,BDL,1.8,-,-,-,-
2888.0,"CHATHE RIVER NEAR CHRISTIAN INSTITUTE OF HEALTH SCIENCES AND RESEARCH (CIHSR),
DIMAPUR",NAGALAND,17.1,28.0,5.4,7.6,7.1,8.0,28,181,1.2,2.9,BDL,1.2,-,-,-,-
2891.0,DZUCHA RU IN KOHIMA,NAGALAND,11.4,25.5,5.4,8.0,7.5,8.4,78,280,1,2.3,0.6,1.5,-,-,-,-
2889.0,DZUDZA RU IN KOHIMA,NAGALAND,10.0,26.1,5.4,8.8,7.0,8.4,57,142,BDL,1.8,BDL,2.7,-,-,-,-
2892.0,"DZUNA RU IN KOHIMA, ADJOINING THE NEW KOHIMA MUNIC",NAGALAND,11.5,25.4,5.2,7.2,7.2,8.3,32,386,1.2,2.4,1,2.4,-,-,-,-
2893.0,"DZUNA RU (CONFLUENCE OF DZUCHA & DZUNA RU)
IN KOHI",NAGALAND,11.3,25.7,5.4,7.0,7.0,8.1,135,375,1.2,2.3,1.1,3.1,-,-,-,-
4719.0,RIVER TORSA D/S OF GHUGHUMARI,WEST BENGAL,14.0,29.0,6.8,7.4,6.8,7.8,72,166,1.2,2.6,BDL,1.37,1300,5000,5000,11000
4724.0,RIVER TORSA AT HASIMARA,WEST BENGAL,18.0,29.0,6.1,8.6,6.9,7.82,39,87,1.2,2.1,BDL,1.83,1300,5000,5000,22000
1232.0,MAHI (D/S) CONF WITH R. CHAP (UNDER SAGWARA- SARHI,RAJASTHAN,19.0,32.0,4.4,6.5,8.2,8.6,360,560,BDL,2.9,1.1,2.07,28,460,75,1100
1864.0,MAHI AT MUJPUR,GUJARAT,26.0,32.0,1.3,7.9,7.8,8.4,385,2860,BDL,2.3,BDL,0.59,4,30,63,210
1233.0,"MAHI AT BADNAWAR, M.P.",MADHYA PRADESH,17.0,26.0,6.8,7.9,7.5,8.7,306,511,BDL,1.3,0.62,2.12,2,2,40,70
4.0,MAHI AT SEVALIA,GUJARAT,20.0,30.0,6.3,8.8,7.3,8.6,308,508,BDL,1,BDL,0.68,4,12,33,63
5.0,MAHI AT VASAD,GUJARAT,23.0,30.0,6.9,8.5,7.9,8.4,312,533,BDL,1,BDL,0.58,4,33,49,130
1229.0,"MAHI NEAR RAJASTHAN BORDER AT KADANA DAM,",GUJARAT,26.0,31.0,7.1,8.8,7.7,8.3,277,483,BDL,BDL,BDL,0.63,2,4,11,34
1230.0,"MAHI AFTER CONF. WITH ANAS AT PARDI (BANASWADA),",GUJARAT,26.0,31.0,7.1,8.7,7.8,8.4,360,476,BDL,BDL,BDL,0.57,2,12,11,70
1231.0,"MAHI AT VIRPUR,",GUJARAT,26.0,30.0,7.6,8.6,7.9,8.3,264,480,BDL,BDL,BDL,0.6,2,12,21,64
1863.0,MAHI AT UMETA BRIDGE,GUJARAT,23.0,32.0,7.2,8.5,7.9,8.5,387,599,BDL,BDL,BDL,0.58,6,26,49,130
3206.0,MAHI AT SHERKHI BRIDGE,GUJARAT,22.0,32.0,2.3,8.6,8.0,8.8,320,1663,BDL,8.9,BDL,0.58,4,47,47,350
3318.0,"MAHI AT RANISINGH VILLAGE, RATLAM, UJJAIN",MADHYA PRADESH,25.0,29.0,6.2,7.9,7.6,7.9,280,570,1.4,2.1,0.61,1.13,2,8,43,50
3848.0,ANAS RIVER NEAR ROAD BRIDGE JHABUA,MADHYA PRADESH,17.0,26.0,6.9,8.0,7.6,8.3,262,669,BDL,1.4,0.59,1.73,2,2,39,84
1221.0,"SABARMATI AT KHEROJ BRIDGE,",GUJARAT,26.0,27.7,4.2,8.7,7.2,8.1,420,1248,BDL,1.9,BDL,1.76,4,70,21,280
1223.0,SABARMATI AFTER CONF. WITH MESHWA AT VAUTHA (NEAR,GUJARAT,27.0,30.0,0.3,6.5,7.1,8.0,510,2661,5,48,BDL,0.52,2,540,70,1700
1409.0,"SABARMATI AT RAILWAY BRIDGE AHMEDABAD,",GUJARAT,25.0,29.0,6,8.2,7.4,8.5,220,340,BDL,2.5,BDL,0.68,17,220,150,540
1866.0,"SABARMATI RIVER AT HANSAOL BRIDGE,",GUJARAT,25.0,29.0,6.2,8.0,7.3,8.1,223,403,BDL,2.6,BDL,1.02,6,63,47,280
1.0,SABARMATI AT DHAROI DAM,GUJARAT,23.0,29.0,5.3,8.0,7.4,8.3,340,512,BDL,0.8,BDL,BDL,2,4,4,27
2.0,SABARMATI AT AHMEDABAD AT V.N. BRIDGE,GUJARAT,25.0,30.0,0.3,7.5,7.0,8.4,247,3047,1.9,168,BDL,0.78,45,1600,280,2200
1407.0,"SABARMATI AT GANDHI NAGAR CHILODA BRIDGE,
LEKAWADA",GUJARAT,27.0,29.0,7,7.9,7.7,8.3,322,362,1.1,1.9,BDL,0.31,4,47,21,240
1408.0,"SABARMATI AT VILL. MIROLI TALUKA DASCROI,
AHMEDABA",GUJARAT,29.0,33.0,0.3,4.2,7.1,8.2,664,2630,9,76,BDL,0.61,170,1600,920,5400
1482.0,"SABARMATI AT MAHUDI JAIN TEMPLE, 150 KM. FORM ORIG",GUJARAT,28.0,28.0,7,7.3,7.9,8.2,415,452,1,2,BDL,BDL,4,12,33,70
2075.0,"DHAROI DAM, DIST. MEHSANA.",GUJARAT,24.0,29.0,5,8.1,7.6,8.3,334,643,0.5,1.1,BDL,BDL,2,4,2,27
1222.0,"SHEDHI AT KHEDA,",GUJARAT,24.0,33.0,2.3,6.1,7.5,8.5,460,2530,1.3,8.7,BDL,1.12,17,1600,110,1600
1437.0,"KHARI AT LALI VILLAGE NEAR AHMEDABAD,",GUJARAT,27.0,30.0,BDL,0.3,7.2,8.0,230,3422,42,189,BDL,1.463,540,4300,1600,21000
3321.0,"NARMADA AT AMARKANTAKE FROM ORIGIN POINT,
REWA",MADHYA PRADESH,18.5,29.5,7.5,8.4,7.5,8.01,218,387,BDL,1.7,BDL,0.49,2,18,26,43
1242.0,NARMADA NEAR SOURCE AT AMARKANTAK M.P.,MADHYA PRADESH,18.0,29.5,3.6,7.7,7.0,7.9,183,2216,BDL,0.4,BDL,0.42,2,18,2,44
1241.0,NARMADA AT MANDLA NEAR ROAD BDG. M.P.,MADHYA PRADESH,17.2,26.0,6.8,8.3,7.2,8.7,160,363,BDL,2.6,BDL,0.8,2,14,17,48
1240.0,NARMADA AT NARSINGHPUR M.P.,MADHYA PRADESH,17.0,23.5,7,8.6,7.0,8.3,170,357,BDL,1.9,BDL,1.16,2,11,12,49
2106.0,NARMADA AT NEMAWAR,MADHYA PRADESH,22.0,28.0,7,7.9,7.3,8.3,279,360,BDL,2,0.31,51,2,18,28,49
45.0,NARMADA AT MANDLESHWAR,MADHYA PRADESH,20.0,24.0,7.3,8.6,7.4,8.5,214,340,BDL,1.3,0.51,1.33,2,2,32,47
1239.0,"NARMADA AT BADWANI, M.P.",MADHYA PRADESH,20.0,24.6,7.2,8.0,7.7,8.3,152,594,BDL,1.2,BDL,1.24,2,2,34,48
1431.0,"NARMADA AT MAHESHWAR, M. P.",MADHYA PRADESH,19.0,24.3,7.3,8.0,7.4,8.1,258,338,BDL,1.3,0.61,1.11,2,2,38,49
2099.0,"NARMADA LALPUR, JABALPUR",MADHYA PRADESH,17.0,25.0,7,8.7,7.4,8.6,130,378,BDL,1.9,BDL,0.87,2,4,9,39
1234.0,NARMADA AT HOSHANGABAD U S,MADHYA PRADESH,17.0,32.0,8.3,9.8,7.5,7.9,246,298,1.1,1.7,0.95,1.75,2,2,26,63
2112.0,"NARMADA NEAR MORTAKKA BRIDGE, BADWAH",MADHYA PRADESH,19.0,24.2,7.2,8.3,7.0,8.3,270,489,BDL,1.2,BDL,3.65,2,2,34,49
44.0,NARMADA AT SETHANIGHAT,MADHYA PRADESH,18.0,31.0,5.8,9.1,7.6,8.39,268,367,1,1.5,1.62,7.64,2,35000,38,160000
1235.0,NARMADA AT HOSHANGABAD D S,MADHYA PRADESH,18.0,30.0,5.6,8.7,7.4,8.2,278,365,1,1.5,2.12,8.12,2,57000,84,160000
2113.0,"NARMADA NEAR PUNASA DAM, PUNASA",MADHYA PRADESH,19.0,24.3,7.1,8.2,7.3,8.4,242,2676,BDL,1.1,0.59,1.02,2,2,27,49
1430.0,NARMADA AT D S OF OMKARESHWAR M.P.,MADHYA PRADESH,19.0,24.4,7,8.1,7.4,8.2,224,292,BDL,1.2,0.58,1.11,2,2,31,49
3322.0,"NARMADA AT MANDLA, NEAR SHAMSHANGHAT, JABALPUR",MADHYA PRADESH,13.0,26.0,7,7.8,7.3,8.6,160,366,BDL,2,BDL,0.85,2,6,14,48
3323.0,"NARMADA AT LALPUR, NEAR WATER SUPPLY INTAKE POINT,",MADHYA PRADESH,17.0,25.2,7,8.6,7.2,8.7,138,411,BDL,1.8,BDL,1.1,2,59,20,48
3324.0,"NARMADA AT PANCHWATIGHAT, BEFORE MIXING
WITH BAWAN",MADHYA PRADESH,17.2,23.5,7,8.1,7.3,8.3,218,385,BDL,1.9,BDL,1.2,2,6,8,400
3325.0,"NARMADA AT SARSWATIGHAT, AFTER MIXING WITH BAWANGA",MADHYA PRADESH,17.2,23.3,7.0,7.8,7.3,8.3,226,2600,BDL,1.9,BDL,1.34,2.0,6.0,10,49
2118.0,NARMADA RIVER AT D/S OF KAPILDHARA,MADHYA PRADESH,18.2,29.6,7.1,7.8,7.19,8.0,179,311,BDL,1.7,BDL,0.45,2.0,18.0,33,47
2123.0,NARMADA AT KORIGHAT HOSHANGABAD,MADHYA PRADESH,17.0,30.0,5.8,8.6,7.59,8.34,251,388,1,1.4,1.42,10.72,2.0,35000.0,63,92000
3847.0,NARMADA RIVER AT DHARAMPURI,MADHYA PRADESH,20.0,24.6,7.1,8.0,7.6,8.3,244,306,BDL,1.4,0.66,1.778,2.0,2.0,32,49
4582.0,"NARMADA AT JAMTARA, NEAR RAILWAY BRIDGE",MADHYA PRADESH,17.3,25.9,7.0,8.4,7.4,8.3,150,3330,0.4,2.0,0.31,1.3,1.8,4.0,39,39
4583.0,NARMADA NEAR ROAD BRIDGE JHANSINGHAT JABALPUR,MADHYA PRADESH,17.4,23.6,7.0,8.2,7.2,8.1,160,390,0.7,1.8,0.46,2.44,1.8,6.0,40,40
4584.0,NARMADA N.H. 44 NEAR ROAD BRIDGE AT BARMAN. JABALP,MADHYA PRADESH,17.3,23.4,7.0,8.1,7.1,8.3,160,352,0.7,1.9,0.36,1.21,1.8,10.0,430,430
4586.0,NARMADA S.N. 44 NEAE ROAD BRIDGE NEAR JHILKOLI NARSINGPUR,MADHYA PRADESH,17.3,23.6,7.0,8.0,7.1,8.2,147,2800,0.8,1.8,0.53,2.42,1.8,1.8,0,0
4587.0,"NARMADA AT NEAR ROAD BRIDGE, SANDIA",MADHYA PRADESH,18.0,25.0,8.6,8.9,8.0,8.1,208,288,1,1.1,1.02,1.55,2.0,2.0,41,58
4588.0,NARMADA AT U/S OF VILLAGE JAIT,MADHYA PRADESH,18.0,32.0,8.8,9.3,7.7,8.0,216,307,1,1.2,0.87,4.6,1.8,2.0,58,63
4589.0,NARMADA AT D/S OF VILL. JAIT,MADHYA PRADESH,17.0,32.0,8.5,9.2,7.8,8.0,258,327,1.2,1.5,1.37,3.03,1.8,2.0,70,84
4590.0,"NARMADA U/S BEFOR CONFLU. RIVER TAWA NEAR
BANDRABH",MADHYA PRADESH,18.0,31.0,8.7,9.9,7.9,8.0,237,295,1,1.4,1.29,2.08,1.8,2.0,49,70
4591.0,NARMADA D/S AFTER CONFLU. RIVER TAWA RAMNAGAR,MADHYA PRADESH,17.0,31.0,8.1,9.7,7.8,8.0,251,306,1.1,1.6,1.83,2.2,1.8,2.0,58,79
4592.0,"RIVER NARMADA AT BUDHNIGHAT, BUDHNI",MADHYA PRADESH,18.0,31.0,8.2,9.9,7.5,8.0,178,287,1.1,1.7,0.97,2.04,1.8,2.0,58,84
4593.0,NARMADA AT D/S OF TEXTILE UNIT VILLAGE. HOLIPURA BUDNI,MADHYA PRADESH,18.0,32.0,8.6,9.3,7.7,8.0,218,285,1.2,1.5,0.17,3.8,1.8,2.0,58,79
4594.0,NARMADA AT BEFOR CONFLU. OF RIVER JAMNER VILL. NEMAWAR,MADHYA PRADESH,22.0,28.0,7.1,7.8,7.4,8.6,319,352,0.7,2.4,0.581,0.857,2.0,18.0,30,49
4595.0,NARMADA 500 M.D/S NEAR JAIN MANDER VILLAGE NEMAWAR,MADHYA PRADESH,20.0,28.0,7.0,7.8,7.4,8.3,325,343,0.7,2.8,0.011,0.918,2.0,6.0,29,58
4596.0,NARMADA AT HANUWANTIA DIST. KHANDWA,MADHYA PRADESH,19.0,24.8,7.2,8.2,7.5,8.5,208,284,0.6,1.1,0.602,0.932,1.0,1.0,14,43
4597.0,NARMADA AT U/S OMKAREWHWAR DAM KHANDWA,MADHYA PRADESH,19.0,24.4,7.0,8.2,7.4,8.2,248,429,0.6,1.1,0.512,0.908,1.0,1.0,31,43
4598.0,NARMADA RIVER AT DHARESHWAR,MADHYA PRADESH,20.0,25.0,7.2,8.4,7.5,8.4,248,328,0.5,1.2,0.521,1.291,1.0,1.0,31,49
4599.0,NARMADA NEAR W/S INTAKE JALLOD,MADHYA PRADESH,19.0,24.3,7.3,8.0,7.5,8.1,207,305,0.6,1.0,0.601,1.098,1.0,1.0,32,43
4600.0,NARMADA RIVER AT SHAHASTRADHARA (JALKOTI),MADHYA PRADESH,19.0,24.3,7.2,8.3,7.6,8.3,254,341,0.5,1.1,0.521,1.966,1.0,1.0,33,48
1981.0,"NARMADA AT ZANOR (NTPC), BHARUCH",GUJARAT,26.0,30.0,6.4,7.7,7.5,8.4,321,481,BDL,1.1,BDL,BDL,21.0,49.0,68,92
1243.0,"NARMADA AT BHARUCH, ZADESHVAR",GUJARAT,26.0,30.0,3.6,7.5,7.5,8.2,244,972,BDL,1.0,BDL,BDL,70.0,170.0,210,320
1236.0,"CHOTA TAWA BEFORE CONFL. WITH RIVER NARMADA, M.P.",MADHYA PRADESH,20.0,24.0,6.8,8.2,7.4,8.5,298,661,BDL,1.4,BDL,1.25,2.0,2.0,40,70
2100.0,"GOUR RIVER BHOGA DOOR, JABALPUR",MADHYA PRADESH,17.0,26.0,7.0,7.8,7.2,8.7,130,410,BDL,1.6,BDL,0.8,2.0,2.0,12,47
2114.0,KUNDA AT KHARGONE,MADHYA PRADESH,19.0,25.0,5.6,7.6,7.7,8.7,345,569,BDL,1.8,BDL,6.12,2.0,150.0,40,1600
3305.0,"BANJAR AT MALANJKHAND NEAR W/S INTAKE POINT, JABALPUR",MADHYA PRADESH,17.3,26.5,7.0,7.8,7.4,8.6,160,3680,BDL,1.9,BDL,0.8,2.0,4.0,11,46
3326.0,"SIMRAR AT KATNI NEAR ACC W/S INTAKE POINT, JABALPUR",MADHYA PRADESH,23.4,27.8,5.1,6.9,7.3,8.6,160,368,BDL,1.9,BDL,2.21,2.0,10.0,14,41
3828.0,"HIRAN, NH 7 ROAD BRIDGE, SIHORA, DIST JABALPUR",MADHYA PRADESH,17.2,24.6,6.1,7.9,7.2,8.9,210,1168,1,2.4,BDL,1.16,2.0,34.0,17,480
3829.0,"HIRAN, NH -12 ROAD BRIDGE VIL VIKRAMPUR ,DIST. NARSINGPUR",MADHYA PRADESH,17.5,23.5,7.0,7.8,7.1,8.6,182,398,BDL,2.8,BDL,0.75,2.0,24.0,17,210
,,,MIN,MAX,MIN,MAX,MIN,MAX,MIN,MAX,MIN,MAX,MIN,MAX,MIN,MAX,MIN,MAX
2115.0,TAPI AT NEPA NAGAR 100 METRE D/S AFTER MIXING PANDHAR NALLAH,MADHYA PRADESH,19,26,6.6,8.2,7.3,8.5,255,490,BDL,1.6,BDL,1.64,2,12,38,210
9.0,TAPI AT NEPANAGAR,MADHYA PRADESH,19,26,6.8,8,7.3,8.4,208,430,BDL,1.2,BDL,0.91,2,2,32,49
10.0,TAPI AT BURHANPUR,MADHYA PRADESH,19,26,4.6,8.3,7.6,8.5,285,686,1.3,2.4,BDL,9.6,2,3,48,220
1250.0,TAPI AT HATHNUR M.P.,MADHYA PRADESH,19,26,4.8,8.2,7.6,8.3,280,659,1.3,1.9,BDL,1.29,2,6,47,170
46.0,"TAPI AT UKAI, SHERULA BRIDGE",GUJARAT,24,34,6.6,7.5,6.8,8.4,320,4848,BDL,1.2,BDL,0.19,2,54,2,73
1247.0,TAPI AT MANDAVI,GUJARAT,26,29,7,7.6,7,8.3,321,4128,BDL,1.2,BDL,0.81,2,14,2,58
1983.0,TAPI RIVER NEAR BARDOLI (KAPP BRIDGE) BARDOLI,GUJARAT,25,30,6.5,7.4,7,7.9,335,553,BDL,0.9,BDL,0.19,2,17,2,63
47.0,"TAPI AT KATHORE, (NH-8 BRIDGE)",GUJARAT,25,29,7,7.6,7,8,232,4708,BDL,1.2,BDL,0.36,2,11,2,54
1248.0,TAPI AT SURAT U/S KATHORE,GUJARAT,25,29,7,7.4,7.1,8,240,678,BDL,1.8,BDL,0.54,2,23,2,79
1982.0,"TAPI AT RANDER BRIDGE, SURAT",GUJARAT,25,29,7,7.4,7.1,8.4,216,813,BDL,1.3,BDL,0.47,2,14,2,83
2071.0,"TAPI RIVER AT ONGC BRIDGE AT SURAT, DIST. SURAT",GUJARAT,26,32,0.7,7,7.1,7.7,2005,61120,BDL,2.3,BDL,0.34,6,23,47,150
2070.0,"KIM RIVER AT SAHOL BRIDGE, OLPAD HANSOT
ROAD, DIST. SURAT",GUJARAT,25,30,4.8,7.2,7.1,8.2,211,3160,BDL,2,BDL,0.55,6,21,39,64
3203.0,"AMRAVATI AT VILLAGE DADHAL , TA ANKLESHWAR,
BHARUCH",GUJARAT,27,31,6.1,8.2,7.4,8.2,298,1410,BDL,1.6,BDL,0.35,27,79,94,170
1100.0,"MAHANADI AT KHARAD, CHHATISGARH.",CHHATTISGARH,19,32,7.3,7.9,8,8.6,222,298,1.1,2.2,1.9,4.7,2,20,2,220
1282.0,"MAHANADI AT SHEORINARAYAN VILLAGE, CHHATISGARH.",CHHATTISGARH,19.5,32,6.3,7.5,8.2,8.7,70,292,1.3,2.5,2.1,5.2,2,30,10,220
1467.0,"MAHANADI AFTER CONFL. WITH RIVER MAND,
CHHATISGARH",CHHATTISGARH,20,31.5,6.5,7.5,8,8.7,244,322,1.2,2.6,2.8,4.9,2,40,2,280
3168.0,"DOWNSTREAM OF HASDEO RIVER NEAR URGA
VILLAGE KORBA",CHHATTISGARH,25.5,26.1,6.4,6.9,7.1,7.2,118,12621,BDL,1.4,BDL,7.84,13,260,49,700
1101.0,"MAHANADI AT INTERSTATE BOUNDRY, CHHATISGARH.",CHHATTISGARH,19,27,6.5,7.4,7,7.6,194,224,1.2,4.2,0.84,44.03,2,9,9,48
1281.0,MAHANADI AT HIRAKUD RESERVOIR,ODISHA,22,31,7.4,8.8,6.8,8.3,124,215,BDL,1.5,BDL,1.23,20,490,130,2400
1270.0,MAHANADI AT SAMBALPUR U/S,ODISHA,21,30,6.6,8.6,6.6,8.2,143,299,BDL,1.4,BDL,0.88,45,1400,130,3500
1271.0,MAHANADI AT SAMBALPUR D/S,ODISHA,22,31,7,8.4,6.9,8.5,157,342,1,2.7,BDL,1.8,130,2200,540,7000
2405.0,SAMBHALPUR FD/s AT HUMA,ODISHA,23,29,6.8,8.4,7,8.3,140,206,BDL,1.5,BDL,1.02,130,2200,330,3500
1272.0,"MAHANADI D/S (AFTER CONFL. WITH R. ONG
SONEPUR U/S",ODISHA,23,30,6.8,8.8,7.1,8.3,128,255,BDL,1.5,BDL,1.29,2,1300,20,3300
1274.0,MAHANADI A/c WITH TEL (SONEPUR D/S),ODISHA,23,31,6.2,8.8,7.1,8.3,147,287,BDL,1.9,BDL,2.24,20,1700,170,3400
2404.0,MAHANADI POWER CHANNEL D/S NEAR BURLA,ODISHA,22,30,6.8,8,7.1,7.9,143,208,BDL,1.7,BDL,1.23,20,1300,170,2400
2406.0,MAHANADI AT MUNDALI (WATER INTAKE POINT OF BHUBANE,ODISHA,19,33,7.1,8.8,7.2,8.4,142,212,BDL,1.4,BDL,2.49,20,790,170,2400
3887.0,SAMBALPUR FD/S T SHANKARMATH,ODISHA,23,29,5.3,8.2,6.6,8,140,408,BDL,1.8,BDL,1.07,170,1700,790,4900
1275.0,MAHANADI AT TIKARPADA,ODISHA,18,28,5.8,10.4,6.8,8.3,145,272,BDL,1.6,BDL,1.91,2,780,78,1700
1276.0,MAHANADI AT NARSINGHPUR,ODISHA,19,35,7.2,9.2,7.2,8.4,146,225,BDL,1.7,BDL,1.82,45,1400,170,2800
1277.0,MAHANADI AT CUTTACK U/S,ODISHA,19,33,6.8,9.4,7.3,8.5,82,209,BDL,1.5,BDL,1.62,78,1300,230,3500
1278.0,MAHANADI AT CUTTACK D/S,ODISHA,20,31,6.3,8.9,7.3,8.3,135,230,BDL,2.6,BDL,1.99,220,2300,790,4900
3888.0,MAHANADI POWER CHANNEL U/S,ODISHA,22,31,6.8,8.2,6.9,8.1,146,195,BDL,1.4,BDL,1.18,2,330,78,790
3890.0,MAHANADI AT CUTTACK FD/S AT GATIRAUTAPATNA,ODISHA,19,30,6.2,8.6,7.1,8.4,124,212,BDL,1.7,BDL,1.61,130,1700,330,3500
2407.0,"MAHANADI AT PARADEEP U/S (BEFORE INDUSTRIAL
ACTIVITY AT PARADEEP)",ODISHA,21,33,6.4,8.6,7.1,8.1,146,7746,BDL,1.3,BDL,1.06,2,490,2,1700
1639.0,MAHANADI AT PARADEEP D/s,ODISHA,21,34,6,8.6,7.1,8.4,292,42560,BDL,2.4,BDL,2.13,2,700,2,1700
1107.0,"SEONATH AT U/S RAJNANDGAON, CHHATISGARH.",CHHATTISGARH,23,36,7.4,7.6,7,7.5,229,229,1,1.8,BDL,0.33,4,380,2,1600
1266.0,"SEONATH AT SHIMGA AFTER CONFL. WITH R.
KHAROON, CHHATISGARH.",CHHATTISGARH,24,27,6.4,7.2,7.4,7.6,274,398,2.8,3.8,-,-,4,46,2,94
1845.0,"SEONATH RIVER WATER SUPPLY WELL, DURG, CHHATISGARH.",CHHATTISGARH,22,28,7.1,7.8,7.1,7.5,200,204,1.1,1.8,BDL,BDL,5,270,2,1600
3166.0,"SEONATH AT JHINGHRI VILLAGE, A/C OF SAMODA NALLA, CHHATISGARH.",CHHATTISGARH,22,36,5.5,7.4,7.4,7.8,465,465,2,3.8,BDL,0.78,2,360,4,1600
3167.0,"SEONATH AT RAJNANDGAON, D/S AT MOHAD, RAJNANDGAON, CHHATISGARH.",CHHATTISGARH,23,35,7.3,7.6,7.1,7.5,208,208,1.2,1.8,BDL,34.02,2,500,9,1700
1265.0,"KHAROON AT RAIPUR U/S, CHHATISGARH.",CHHATTISGARH,21,26,6.6,7.1,7.3,7.5,186,387,2,2.7,-,-,14,25,9,84
1846.0,"KHAROON RIVER A/C KHAPRI DRAIN, CHHATISGARH.",CHHATTISGARH,22,36,7,7.6,7.1,7.6,294,294,1.5,2.2,BDL,0.64,12,300,2,1700
1847.0,"KHAROON RIVER B/C KHAPRI DRAIN, DURG, RAIPUR
ROAD BRIDGE, CHHATISGARH.",CHHATTISGARH,23,35,6.7,7.6,7.2,7.5,285,285,1.6,2.1,BDL,0.98,10,210,2,1600
1853.0,"KHAROON RIVER BUNDRI, RAIPUR, CHHATISGARH.",CHHATTISGARH,23.0,26.0,6.4,6.5,7.3,7.6,192,396,1.9,2.6,-,-,11,11,7,79
1105.0,"HASDEO AT U/S KORBA, CHHATISGARH.",CHHATTISGARH,25.4,25.9,7.0,8.0,7.0,7.1,126,10403,BDL,0.6,BDL,2.63,11,78,33,270
1106.0,"HASDEO AT U/S OF CHAMPA, CHHATISGARH.",CHHATTISGARH,19.0,30.0,6.9,7.5,7.4,8.5,298,350,1.2,7.5,2.1,6,4,40,22,170
3165.0,"HASDEO RIVER 100 METER DOWNSTREAM AFTER
CONFLUENCE",CHHATTISGARH,25.5,26.1,0.6,7.4,7.1,7.1,107,15134,BDL,0.8,BDL,5.05,9,140,27,490
3169.0,"DRINKING WATER INTAKE WELL OF MUNICIPAL CO.
KORBA",CHHATTISGARH,25.5,26.2,0.6,8.0,7.1,7.1,118,12896,BDL,0.6,BDL,2.65,2,37,17,240
3170.0,DRINKING WATER INTAKE WELL OF MUNICIPAL CO. KORBA,CHHATTISGARH,25.6,26.3,7.2,8.0,7.1,7.2,114,15723,BDL,0.4,BDL,2.3,18,20,18,20
1267.0,IB AT SUNDARGARH,ODISHA,20.0,31.0,6.4,8.2,6.8,8.3,66,183,BDL,1.6,BDL,7.43,110,1400,330,1800
1268.0,IB AT JHARSUGUDA (INTAKE),ODISHA,18.0,29.0,7.4,8.6,6.8,8.3,109,204,BDL,1.8,BDL,1.07,45,1100,230,2200
1269.0,IB AT BRAJARAJNAGAR (INTAKE) D/S,ODISHA,17.0,29.0,7.4,8.8,6.9,8.1,102,248,BDL,1.8,BDL,0.941,130,2200,490,3500
1300.0,IB AT BRAJARAJNAGAR U/S,ODISHA,18.0,30.0,7.8,8.6,6.9,8.3,97,242,BDL,1.8,BDL,0.81,45,790,330,3500
2409.0,SERUA AT CUTTACK FD/s (SERUA) AT SANKHATRASA,ODISHA,20.0,31.0,6.1,8.8,7.0,8.5,128,301,BDL,3.8,BDL,2.51,130,22000,490,54000
1279.0,KUAKHAI AT BHUBANESWAR U/s,ODISHA,19.0,30.0,5.4,8.9,7.1,8.3,141,258,BDL,1.9,BDL,0.81,330,2400,1300,5400
1280.0,KUAKHAI AT BHUBANESWAR D/s,ODISHA,19.0,30.0,4.2,8.8,7.0,8.4,152,391,2.2,4.7,BDL,8.2,1300,92000,2400,160000
2410.0,KUAKHAI AT BHUBANESWAR FU/s,ODISHA,19.0,30.0,4.7,9.7,7.4,8.3,113,251,BDL,1.7,BDL,0.7,130,1700,490,3500
1301.0,KATHAJODI AT CUTTACK D/s,ODISHA,19.0,30.0,6.1,8.4,7.5,8.5,162,318,BDL,3.6,BDL,2.34,1300,24000,1700,54000
1640.0,BIRUPA AT CHOUDWAR D/s,ODISHA,20.0,33.0,6.2,8.6,7.0,8.5,121,226,BDL,1.3,BDL,1.42,45,4900,230,7000
